{
  "$schema": "https://json-schema.org/draft/2020-12/schema",
  "title": "My GPT News edition",
  "type": "object",
  "required": ["id", "date", "publishedAt", "updatedAt", "stories"],
  "properties": {
    "id": { "type": "string", "format": "date-time" },
    "date": { "type": "string", "pattern": "^\\d{4}-\\d{2}-\\d{2}$" },
    "publishedAt": { "type": "string", "format": "date-time" },
    "updatedAt": { "type": "string", "format": "date-time" },
    "stories": { "type": "array", "minItems": 1 }
  }
}
