{
  "id": "2026-10-30T09:48:16Z",
  "date": "2026-10-30",
  "publishedAt": "2026-10-30T09:48:16Z",
  "updatedAt": "2026-10-30T09:48:16Z",
  "stories": [
    {
      "id": "crimson-desert-charting-unknown-dlc-launch-2026-10-29",
      "headline": "Crimson Desert: Charting the Unknown expansion launches with ocean exploration",
      "summary": "Pearl Abyss released Charting the Unknown on October 29, adding ship travel, underwater exploration, new storylines and expanded housing and management activities. The paid expansion substantially broadens what players can do across Pywel and requires the base game.",
      "categories": [
        "Releases",
        "Updates"
      ],
      "game": {
        "name": "Crimson Desert Enhanced",
        "id": "crimson-desert-enhanced"
      },
      "sourceUrl": "https://crimsondesert.pearlabyss.com/en-US/News/Notice/Detail?_boardNo=143",
      "publishedAt": "2026-10-30T09:48:16Z",
      "featured": true,
      "imageUrl": "https://shared.fastly.steamstatic.com/store_item_assets/steam/apps/5001840/ed9f91c5529b5e043f58b5fa99de414c3c007772/header.jpg?t=1793335501",
      "steam": {
        "url": "https://store.steampowered.com/app/5001840/Crimson_Desert_Enhanced_Charting_the_Unknown/"
      }
    },
    {
      "id": "age-of-empires-iv-raiders-of-the-north-launch-2026-10-29",
      "headline": "Age of Empires IV adds Vikings, Scots and co-op Crucible challenges",
      "summary": "Raiders of the North launched October 29 with two playable civilizations, four new Crucible missions, two northern biomes and two-player co-op support for Crucible. The expansion adds distinct raiding and defensive strategies for PC RTS players.",
      "categories": [
        "Releases",
        "Updates"
      ],
      "game": {
        "name": "Age of Empires IV",
        "id": "age-of-empires-iv"
      },
      "sourceUrl": "https://www.ageofempires.com/news/raiders-of-the-north-for-age-of-empires-iv-available-now/",
      "publishedAt": "2026-10-30T09:48:16Z",
      "featured": false,
      "imageUrl": "https://cms-assets.xboxservices.com/assets/3b/17/3b172948-2ccd-4011-bcd3-291cdf4d856c.png?n=XboxGamesShowcase2026_AgeOfEmpiresIV_RaidersOfTheNorth_Announce_Thumbnail_Primary.png",
      "steam": {
        "url": "https://store.steampowered.com/app/4336170/Age_of_Empires_IV_Raiders_of_the_North/"
      }
    },
    {
      "id": "monster-train-2-the-punished-dlc-announced-2026-10-28",
      "headline": "Monster Train 2 announces The Punished clan DLC for November 10",
      "summary": "Shiny Shoe unveiled The Punished, a paid November 10 expansion led by Archus. Its new clan turns damage to friendly units and card sacrifices at the Monolith into combat advantages. The studio says this will conclude the game's planned post-launch content updates.",
      "categories": [
        "Announcements"
      ],
      "game": {
        "name": "Monster Train 2",
        "id": "monster-train-2"
      },
      "sourceUrl": "https://www.pcgamer.com/games/card-games/monster-train-2-the-punished-dlc/",
      "publishedAt": "2026-10-30T09:48:16Z",
      "featured": false,
      "imageUrl": "https://shared.fastly.steamstatic.com/store_item_assets/steam/apps/4739980/be8a82d818d36cfdb559bd8c8acd9dcbc5b83673/header.jpg?t=1793196542",
      "steam": {
        "url": "https://store.steampowered.com/app/4739980/Monster_Train_2_The_Punished"
      }
    },
    {
      "id": "planet-coaster-2-spooktacular-pack-launch-2026-10-29",
      "headline": "Planet Coaster 2 launches Spooktacular Pack and free Update 12",
      "summary": "Frontier released the Spooktacular Pack on October 29 with customizable walkthrough attractions, seven rides and more than 700 scenery pieces. A separate free update adds Reaction Points, photo stand-ins and a Scared guest reaction, expanding park storytelling even without the paid DLC.",
      "categories": [
        "Releases",
        "Updates"
      ],
      "game": {
        "name": "Planet Coaster 2",
        "id": "planet-coaster-2"
      },
      "sourceUrl": "https://steamcommunity.com/app/2688950/allnews",
      "publishedAt": "2026-10-30T09:48:16Z",
      "featured": false,
      "steam": {
        "url": "https://store.steampowered.com/app/5362340/Planet_Coaster_2_Spooktacular_Pack/"
      }
    },
    {
      "id": "cairn-on-the-trail-deep-water-free-dlc-2026-10-29",
      "headline": "Cairn receives free Deep Water climbing DLC",
      "summary": "The Game Bakers released On the Trail: Deep Water on October 29 at no extra cost to Cairn owners. It adds the Haken and Ruka cliffs, the Lamu climbing gym, water soloing, playable Marco and free-roam climbing options, giving existing players fresh routes to master.",
      "categories": [
        "Releases",
        "Updates",
        "Deals & Events"
      ],
      "game": {
        "name": "Cairn",
        "id": "cairn"
      },
      "sourceUrl": "https://store.steampowered.com/app/4487450/Cairn_On_the_Trail_Deep_Water/",
      "publishedAt": "2026-10-30T09:48:16Z",
      "featured": false,
      "imageUrl": "https://shared.fastly.steamstatic.com/store_item_assets/steam/apps/4487450/b0b38b2aa0767d5b08553820b59f98c2c7540f00/header.jpg?t=1793289251",
      "steam": {
        "url": "https://store.steampowered.com/app/4487450/Cairn_On_the_Trail_Deep_Water/"
      }
    },
    {
      "id": "hexologic-steam-free-to-keep-2026-10-29",
      "headline": "Hexologic is free to keep on Steam until October 31",
      "summary": "Steam's limited promotion makes the Sudoku-inspired hexagonal puzzle game Hexologic free to claim permanently until October 31 at 17:00 UTC (18:00 in Belgium). It includes more than 90 puzzles across six worlds; claiming before the deadline adds the full game to your library.",
      "categories": [
        "Deals & Events"
      ],
      "game": {
        "name": "Hexologic",
        "id": "hexologic"
      },
      "sourceUrl": "https://store.steampowered.com/app/785890/Hexologic/",
      "publishedAt": "2026-10-30T09:48:16Z",
      "featured": false,
      "imageUrl": "https://shared.fastly.steamstatic.com/store_item_assets/steam/apps/785890/header.jpg?t=1793292026",
      "steam": {
        "url": "https://store.steampowered.com/app/785890/Hexologic/"
      },
      "price": {
        "amount": 0,
        "currency": "EUR",
        "discountPercent": 100,
        "checkedAt": "2026-10-30T09:48:16Z"
      }
    },
    {
      "id": "atmosfar-early-access-launch-2026-10-29",
      "headline": "ATMOSFAR enters Steam Early Access with four-player sky survival",
      "summary": "Apog Labs launched ATMOSFAR in Early Access on October 29. Players explore floating islands using customizable Wasp aircraft and build a mobile Cloud Cruiser airship base, alone or with up to three friends. The initial build has two regions, with more content planned during development.",
      "categories": [
        "Releases"
      ],
      "game": {
        "name": "ATMOSFAR",
        "id": "atmosfar"
      },
      "sourceUrl": "https://steamcommunity.com/app/1798230/allnews",
      "publishedAt": "2026-10-30T09:48:16Z",
      "featured": false,
      "imageUrl": "https://shared.fastly.steamstatic.com/store_item_assets/steam/apps/1798230/96e6f00d5ecb7c37ba07577ac02ac75fad16055a/header.jpg?t=1793341656",
      "steam": {
        "url": "https://store.steampowered.com/app/1798230/ATMOSFAR/"
      }
    },
    {
      "id": "probably-stolen-350k-first-day-sales-2026-10-29",
      "headline": "Probably Stolen developer reports 350,000 sales in its first 24 hours",
      "summary": "Questing Goose Studio says its cyberpunk shopkeeping simulator sold more than 350,000 copies during the first day after its October 28 PC launch, reaching more than 112,000 peak concurrent Steam players. The reported figures mark an unusually strong debut for an independent management game.",
      "categories": [
        "Industry News",
        "Releases"
      ],
      "game": {
        "name": "Probably Stolen - Cyberpunk Shopkeeper Sim",
        "id": "probably-stolen-cyberpunk-shopkeeper-sim"
      },
      "sourceUrl": "https://steamcommunity.com/app/4348910/allnews",
      "publishedAt": "2026-10-30T09:48:16Z",
      "featured": false,
      "imageUrl": "https://shared.akamai.steamstatic.com/store_item_assets/steam/apps/4348910/c7ac4685d5bbae555b09f9e76d0bc2e99a90cea1/page_bg_raw.jpg?t=1785772230",
      "steam": {
        "url": "https://store.steampowered.com/app/4348910/Probably_Stolen_Cyberpunk_Shopkeeper_Sim/"
      }
    }
  ]
}
